{"schema_version":"kdd235a.entrant.v1","entrant_id":"minimal_gaussian_v1","command":["./entrant.py","independent_gaussian"],"prediction_type":"independent_gaussian","component_sources":{"transition":"entrant","reward":"benchmark","termination":"benchmark"},"capabilities":["initialize","fit_or_load","one_step","recursive_rollout","policy_probability"],"deterministic":true,"support_handling_acknowledged":true,"checkpoint":{"checkpoint_id":"minimal-public-example-v1","source_commit":"0000000"}}
