{"schema_version":"kdd235a.entrant.v1","entrant_id":"minimal_ensemble_v1","command":["./entrant.py","gaussian_ensemble"],"prediction_type":"gaussian_ensemble","component_sources":{"transition":"entrant","reward":"benchmark","termination":"benchmark"},"capabilities":["initialize","fit_or_load","one_step","recursive_rollout","policy_probability"],"deterministic":true,"support_handling_acknowledged":true,"checkpoint":{"checkpoint_id":"minimal-public-example-v1","source_commit":"0000000"}}
