{"schema_version":"kdd235a.entrant.v1","entrant_id":"kdd235b_recurrent_gaussian_v1","command":["./entrant.py"],"prediction_type":"independent_gaussian","component_sources":{"transition":"entrant","reward":"benchmark","termination":"benchmark"},"capabilities":["initialize","fit_or_load","one_step","recursive_rollout","policy_probability"],"deterministic":true,"support_handling_acknowledged":true,"checkpoint":{"checkpoint_id":"kdd235b-recurrent-gaussian-v1","source_commit":"4739d59"},"metadata":{"leaderboard_eligible":false,"planner_objective":"entrant_model_action_cost_proxy"}}
